{
  "ProductName": "HueDeck Generic ARGB Fan 120 mm Ring 18",
  "DisplayName": "ARGB Fan 120 mm Ring 18 - 18 LED",
  "Brand": "Generic",
  "Type": "Fan",
  "LedCount": 18,
  "Width": 9,
  "Height": 9,
  "LedMapping": [0,1,2,3,4,5,6,7,8,9,10,11,12,13,14,15,16,17],
  "LedCoordinates": [[4,0],[5,0],[7,1],[7,2],[8,3],[8,5],[7,6],[7,7],[5,8],[4,8],[3,8],[1,7],[1,6],[0,5],[0,3],[1,2],[1,1],[3,0]],
  "LedNames": ["Led 1","Led 2","Led 3","Led 4","Led 5","Led 6","Led 7","Led 8","Led 9","Led 10","Led 11","Led 12","Led 13","Led 14","Led 15","Led 16","Led 17","Led 18"]
}
