{
  "ProductName": "HueDeck Phanteks D30-120 D-RGB",
  "DisplayName": "D30-120 D-RGB - 30 LED",
  "Brand": "Phanteks",
  "Type": "Fan",
  "LedCount": 30,
  "Width": 9,
  "Height": 9,
  "LedMapping": [0,1,2,3,4,5,6,7,8,9,10,11,12,13,14,15,16,17,18,19,20,21,22,23,24,25,26,27,28,29],
  "LedCoordinates": [[4,2],[5,2],[6,3],[6,4],[6,5],[5,6],[4,6],[3,6],[2,5],[2,4],[2,3],[3,2],[4,0],[5,0],[7,1],[7,2],[8,3],[8,5],[7,6],[7,7],[5,8],[4,8],[3,8],[1,7],[1,6],[0,5],[0,3],[1,2],[1,1],[3,0]],
  "LedNames": ["Front 1","Front 2","Front 3","Front 4","Front 5","Front 6","Front 7","Front 8","Front 9","Front 10","Front 11","Front 12","Frame 1","Frame 2","Frame 3","Frame 4","Frame 5","Frame 6","Frame 7","Frame 8","Frame 9","Frame 10","Frame 11","Frame 12","Frame 13","Frame 14","Frame 15","Frame 16","Frame 17","Frame 18"]
}
