{
  "ProductName": "Lightloom Generic ARGB Strip 18",
  "DisplayName": "ARGB Strip 18 - 18 LED",
  "Brand": "Generic",
  "Type": "Strip",
  "LedCount": 18,
  "Width": 18,
  "Height": 1,
  "LedMapping": [0,1,2,3,4,5,6,7,8,9,10,11,12,13,14,15,16,17],
  "LedCoordinates": [[0,0],[1,0],[2,0],[3,0],[4,0],[5,0],[6,0],[7,0],[8,0],[9,0],[10,0],[11,0],[12,0],[13,0],[14,0],[15,0],[16,0],[17,0]],
  "LedNames": ["Led 1","Led 2","Led 3","Led 4","Led 5","Led 6","Led 7","Led 8","Led 9","Led 10","Led 11","Led 12","Led 13","Led 14","Led 15","Led 16","Led 17","Led 18"]
}
