{
  "ProductName": "Lightloom Corsair QL120 RGB",
  "DisplayName": "QL120 RGB - 34 LED",
  "Brand": "Corsair",
  "Type": "Fan",
  "LedCount": 34,
  "Width": 7,
  "Height": 7,
  "LedMapping": [0,1,2,3,4,5,6,7,8,9,10,11,12,13,14,15,16,17,18,19,20,21,22,23,24,25,26,27,28,29,30,31,32,33],
  "LedCoordinates": [[3,2],[4,3],[3,4],[2,3],[3,0],[5,0],[6,1],[6,3],[6,4],[5,6],[3,6],[2,6],[0,5],[0,3],[0,1],[1,0],[3,2],[4,2],[4,4],[3,4],[2,4],[2,2],[3,0],[4,1],[5,2],[6,3],[5,4],[4,5],[3,6],[2,5],[1,4],[0,3],[1,2],[2,1]],
  "LedNames": ["Front Inner 1","Front Inner 2","Front Inner 3","Front Inner 4","Front Outer 1","Front Outer 2","Front Outer 3","Front Outer 4","Front Outer 5","Front Outer 6","Front Outer 7","Front Outer 8","Front Outer 9","Front Outer 10","Front Outer 11","Front Outer 12","Rear Inner 1","Rear Inner 2","Rear Inner 3","Rear Inner 4","Rear Inner 5","Rear Inner 6","Rear Outer 1","Rear Outer 2","Rear Outer 3","Rear Outer 4","Rear Outer 5","Rear Outer 6","Rear Outer 7","Rear Outer 8","Rear Outer 9","Rear Outer 10","Rear Outer 11","Rear Outer 12"]
}
