{
  "ProductName": "HueDeck ARCTIC P12 PWM PST A-RGB",
  "DisplayName": "P12 PWM PST A-RGB - 12 LED",
  "Brand": "ARCTIC",
  "Type": "Fan",
  "LedCount": 12,
  "Width": 7,
  "Height": 7,
  "LedMapping": [0,1,2,3,4,5,6,7,8,9,10,11],
  "LedCoordinates": [[3,0],[5,0],[6,1],[6,3],[6,4],[5,6],[3,6],[2,6],[0,5],[0,3],[0,1],[1,0]],
  "LedNames": ["Led 1","Led 2","Led 3","Led 4","Led 5","Led 6","Led 7","Led 8","Led 9","Led 10","Led 11","Led 12"]
}
