{
  "ProductName": "HueDeck NZXT F120 RGB Core",
  "DisplayName": "F120 RGB Core - 8 LED",
  "Brand": "NZXT",
  "Type": "Fan",
  "LedCount": 8,
  "Width": 5,
  "Height": 5,
  "LedMapping": [0,1,2,3,4,5,6,7],
  "LedCoordinates": [[2,0],[3,1],[4,2],[3,3],[2,4],[1,3],[0,2],[1,1]],
  "LedNames": ["Led 1","Led 2","Led 3","Led 4","Led 5","Led 6","Led 7","Led 8"]
}
