{
  "ProductName": "HueDeck Thermaltake Riing Trio 12",
  "DisplayName": "Riing Trio 12 - 30 LED",
  "Brand": "Thermaltake",
  "Type": "Fan",
  "LedCount": 30,
  "Width": 7,
  "Height": 7,
  "LedMapping": [0,1,2,3,4,5,6,7,8,9,10,11,12,13,14,15,16,17,18,19,20,21,22,23,24,25,26,27,28,29],
  "LedCoordinates": [[3,2],[4,2],[4,4],[3,4],[2,4],[2,2],[3,1],[4,1],[5,2],[5,3],[5,4],[4,5],[3,5],[2,5],[1,4],[1,3],[1,2],[2,1],[3,0],[5,0],[6,1],[6,3],[6,4],[5,6],[3,6],[2,6],[0,5],[0,3],[0,1],[1,0]],
  "LedNames": ["Inner 1","Inner 2","Inner 3","Inner 4","Inner 5","Inner 6","Middle 1","Middle 2","Middle 3","Middle 4","Middle 5","Middle 6","Middle 7","Middle 8","Middle 9","Middle 10","Middle 11","Middle 12","Outer 1","Outer 2","Outer 3","Outer 4","Outer 5","Outer 6","Outer 7","Outer 8","Outer 9","Outer 10","Outer 11","Outer 12"]
}
