{
  "ProductName": "HueDeck Thermaltake Riing Quad 12",
  "DisplayName": "Riing Quad 12 - 54 LED",
  "Brand": "Thermaltake",
  "Type": "Fan",
  "LedCount": 54,
  "Width": 9,
  "Height": 9,
  "LedMapping": [0,1,2,3,4,5,6,7,8,9,10,11,12,13,14,15,16,17,18,19,20,21,22,23,24,25,26,27,28,29,30,31,32,33,34,35,36,37,38,39,40,41,42,43,44,45,46,47,48,49,50,51,52,53],
  "LedCoordinates": [[4,3],[5,4],[5,5],[4,5],[3,5],[3,4],[4,2],[5,2],[6,3],[6,4],[6,5],[5,6],[4,6],[3,6],[2,5],[2,4],[2,3],[3,2],[4,1],[5,1],[6,2],[7,2],[7,3],[7,5],[7,5],[6,6],[5,7],[4,7],[3,7],[2,6],[1,6],[1,5],[1,3],[1,3],[2,2],[3,1],[4,0],[5,0],[7,1],[7,2],[8,3],[8,5],[7,6],[7,7],[5,8],[4,8],[3,8],[1,7],[1,6],[0,5],[0,3],[1,2],[1,1],[3,0]],
  "LedNames": ["Hub 1","Hub 2","Hub 3","Hub 4","Hub 5","Hub 6","Inner 1","Inner 2","Inner 3","Inner 4","Inner 5","Inner 6","Inner 7","Inner 8","Inner 9","Inner 10","Inner 11","Inner 12","Middle 1","Middle 2","Middle 3","Middle 4","Middle 5","Middle 6","Middle 7","Middle 8","Middle 9","Middle 10","Middle 11","Middle 12","Middle 13","Middle 14","Middle 15","Middle 16","Middle 17","Middle 18","Outer 1","Outer 2","Outer 3","Outer 4","Outer 5","Outer 6","Outer 7","Outer 8","Outer 9","Outer 10","Outer 11","Outer 12","Outer 13","Outer 14","Outer 15","Outer 16","Outer 17","Outer 18"]
}
